{
  "$schema": "../session-system-v2/core/state.schema.json",
  "project": "MOH Time OS — Audit Remediation",
  "owner": "Fleezyflo",
  "current_phase": "post-audit",
  "current_session": 25,
  "phases": {
    "phase-01": {
      "status": "complete",
      "started_session": 1,
      "completed_session": 1,
      "blocked_by": [],
      "prs": [],
      "tasks_total": 4,
      "tasks_complete": 4
    },
    "phase-02": {
      "status": "complete",
      "started_session": 2,
      "completed_session": 2,
      "blocked_by": [],
      "prs": [],
      "tasks_total": 2,
      "tasks_complete": 2
    },
    "phase-03": {
      "status": "complete",
      "started_session": 3,
      "completed_session": 3,
      "blocked_by": [],
      "prs": [],
      "tasks_total": 2,
      "tasks_complete": 2
    },
    "phase-04": {
      "status": "complete",
      "started_session": 4,
      "completed_session": 4,
      "blocked_by": [],
      "prs": [],
      "tasks_total": 2,
      "tasks_complete": 2
    },
    "phase-05": {
      "status": "complete",
      "started_session": 5,
      "completed_session": 5,
      "blocked_by": [],
      "prs": [],
      "tasks_total": 3,
      "tasks_complete": 3
    },
    "phase-06": {
      "status": "complete",
      "started_session": 6,
      "completed_session": 6,
      "blocked_by": [],
      "prs": [],
      "tasks_total": 1,
      "tasks_complete": 1
    },
    "phase-07": {
      "status": "complete",
      "started_session": 7,
      "completed_session": 7,
      "blocked_by": [],
      "prs": [],
      "tasks_total": 6,
      "tasks_complete": 6
    },
    "phase-08": {
      "status": "complete",
      "started_session": 8,
      "completed_session": 8,
      "blocked_by": [],
      "prs": [],
      "tasks_total": 4,
      "tasks_complete": 4
    },
    "phase-09": {
      "status": "complete",
      "started_session": 9,
      "completed_session": 9,
      "blocked_by": [],
      "prs": [],
      "tasks_total": 3,
      "tasks_complete": 3
    },
    "phase-10": {
      "status": "complete",
      "started_session": 10,
      "completed_session": 10,
      "blocked_by": [],
      "prs": [],
      "tasks_total": 6,
      "tasks_complete": 6
    },
    "phase-11": {
      "status": "complete",
      "started_session": 11,
      "completed_session": 11,
      "blocked_by": [],
      "prs": [],
      "tasks_total": 3,
      "tasks_complete": 3
    },
    "phase-12": {
      "status": "complete",
      "started_session": 12,
      "completed_session": 12,
      "blocked_by": [],
      "prs": [],
      "tasks_total": 5,
      "tasks_complete": 5
    },
    "phase-13": {
      "status": "complete",
      "started_session": 13,
      "completed_session": 13,
      "blocked_by": [],
      "prs": [],
      "tasks_total": 2,
      "tasks_complete": 2
    },
    "phase-a": {
      "status": "complete",
      "started_session": 15,
      "completed_session": 15,
      "blocked_by": [],
      "prs": [],
      "task_file": "tasks/PHASE-A-PRODUCTION-HARDENING.md",
      "description": "Production Hardening",
      "tasks_total": 16,
      "tasks_complete": 16
    },
    "phase-b": {
      "status": "complete",
      "started_session": 16,
      "completed_session": 16,
      "blocked_by": [],
      "prs": [],
      "task_file": "tasks/PHASE-B-SYSTEM-COMPLETENESS.md",
      "description": "System Completeness",
      "tasks_total": 10,
      "tasks_complete": 10
    },
    "phase-c": {
      "status": "complete",
      "started_session": 17,
      "completed_session": 17,
      "blocked_by": ["phase-b"],
      "prs": [],
      "task_file": "tasks/PHASE-C-INTELLIGENCE-EXPANSION.md",
      "description": "Intelligence Expansion",
      "tasks_total": 13,
      "tasks_complete": 13
    },
    "phase-d": {
      "status": "complete",
      "started_session": 18,
      "completed_session": 18,
      "blocked_by": ["phase-c"],
      "prs": [],
      "task_file": "tasks/PHASE-D-POLISH.md",
      "description": "Polish",
      "tasks_total": 10,
      "tasks_complete": 10
    }
  },
  "last_pr": 114,
  "last_verified": "2026-06-01",
  "enforcement": {
    "repo": "Fleezyflo/enforcement",
    "read_token_secret": "ENFORCEMENT_READ_TOKEN",
    "dispatch_token_secret": "ENFORCEMENT_DISPATCH_TOKEN",
    "protected_files": [
      "pyproject.toml",
      ".pre-commit-config.yaml",
      ".github/workflows/ci.yml",
      "scripts/check_mypy_baseline.py"
    ]
  }
}
